email,category
"Hello, I need help with my last month’s bill. It seems incorrect.",Billing Issues
"My account is locked. Please help me reset it.",Account Management
"I'm unable to connect to the server. It shows an error.",Technical Support
"Please update my credit card info: 1234 5678 9012 3456",Billing Issues
"I forgot my password. Can you help me reset it?",Account Management
"I’m facing issues installing the software on my machine.",Technical Support
"Here's my Aadhaar number: 1234-5678-9012. Please update the records.",Account Management
"Need support for setting up email on mobile.",Technical Support
